{"type":"trade_decision","version":3,"event_id":"2026-08-03-pltr","decision":"TRADE","trades":[{"instrument_id":"PLTRUSDT-PERP.BINANCE","signal":"STRONG_BUY","expected_move_pct":16.0,"confidence":0.99}],"summary":"T=10: R/O/S/H/F/Q were +2/+2/+2/+2/+1/+1, with strong Q2 results, substantial incremental H2 raises, and positive Q3/FY forward drivers; no veto or extreme core conflict."}