{"type":"trade_decision","version":3,"event_id":"2026-08-11-smci","decision":"TRADE","trades":[{"instrument_id":"SMCIUSDT-PERP.BINANCE","signal":"STRONG_BUY","expected_move_pct":22,"confidence":0.88}],"summary":"Q4 adjusted EPS of $1.70 and 17.6% gross margin exceeded the preview-era bar, while Q1 revenue guidance of $14.5–15.5B and FY27 guidance of $65–72B were dramatically above the market’s true forward hurdles. Those incremental forecasts outweigh likely margin normalization and unresolved order-firmness concerns, supporting a strong positive repricing."}