{"type":"trade_decision","version":3,"event_id":"2026-08-12-nbis","decision":"HOLD","trades":[],"summary":"The processed official capture confirms Q2 2026 identity but contains no financial results, ARR, margins, capacity metrics, or guidance. With no actual surprise or forward information to compare against the elevated pre-event bar, direction is genuinely indeterminate."}