{"type":"trade_decision","version":3,"event_id":"2026-08-11-crwv","decision":"TRADE","trades":[{"instrument_id":"CRWVUSDT-PERP.BINANCE","signal":"MEDIUM_BUY","expected_move_pct":15.0,"confidence":0.82}],"summary":"Revenue of $2.575B was merely in line, but $128M adjusted operating income, $1.51B adjusted EBITDA at 59%, and 1.5 GW of active power materially exceeded the true margin and deployment bars. Quarter-end backlog was only $104B, but more than $25B of early-Q3 commitments effectively validates the ~$129B whisper. The package resolves the central execution concern positively; absent forward guidance and sharply higher debt temper strength and confidence."}