{"type":"trade_decision","version":3,"event_id":"2026-08-10-usar","decision":"TRADE","trades":[{"instrument_id":"USARUSDT-PERP.BINANCE","signal":"STRONG_SELL","expected_move_pct":16.0,"confidence":0.91}],"summary":"Q2 revenue of $5.8M and adjusted EPS of -$0.15 missed the $6.4–$6.8M/-$0.09 to -$0.11 bar, while LCM gross margin collapsed to -27.2%. More importantly, Stillwater remains in qualification with no magnet revenue or binding orders disclosed; reiterating the 600-MTPA target is insufficient after the 48% run-up, supporting a strong negative repricing."}