{"type":"trade_decision","version":3,"event_id":"2026-08-05-wdc","decision":"HOLD","trades":[],"summary":"Q4 results of $3.747B revenue, 54.4% non-GAAP gross margin and $3.56 non-GAAP EPS, plus Q1 midpoints of $4.10B, 55.5% and $4.00, otherwise meet MEDIUM_BUY. However, the processed package does not state the required fiscal-week counts or Q1 endpoint and therefore does not confirm the required 13-week basis; the period-definition HOLD veto applies."}