{"type":"trade_decision","version":3,"event_id":"2026-08-05-sndk","decision":"TRADE","trades":[{"instrument_id":"SNDKUSDT-PERP.BINANCE","signal":"STRONG_BUY","expected_move_pct":16.0,"confidence":0.99}],"summary":"R=8.965, M=84.6, E=39.25, r=10.55, m=84.0, e=45.0; scores +2/+2/+2/0/+2/+2 give C=6, F=4, T=10, P=5, N=0, meeting STRONG_BUY. Five additional NBM agreements, datacenter revenue of $2.977B, and $4.524B of repurchases confirm the result; no material blocker was disclosed."}