{"type":"trade_decision","version":3,"event_id":"2026-08-10-asts","decision":"TRADE","trades":[{"instrument_id":"ASTSUSDT-PERP.BINANCE","signal":"WEAK_SELL","expected_move_pct":7.5,"confidence":0.78}],"summary":"Revenue of $31.5M missed the ~$34–35M bar and leaves a harder H2 ramp. Although FY26 guidance was maintained and government awards/backlog improved, the release lacked dated launches, Block 2 commissioning evidence, or a specific beta timetable; those omissions make the already-consumed execution narrative modestly bearish, with the positive contract news limiting strength."}