{"type":"trade_decision","version":3,"event_id":"2026-08-05-crcl","decision":"HOLD","trades":[],"summary":"HOLD: Engine− applies (Other Revenue $33.582M and total revenue/reserve income $701.315M), but the revised Other Revenue and RLDC-margin guidance includes Arc-token presale revenue without a numerical ex-Arc bridge, making the outlook mixed and preventing a directional outcome."}